id,tweetText,tweetURL,type,tweetAuthor,replyCount,quoteCount,retweetCount,likeCount,views,bookmarkCount,createdAt,allMediaURL
1323803719587287041,"Presidente @Lenin y autoridades del Sis.Nac.Prevención Erradicación de la Violencia, se debe trabajar en construcción, entrega de presupuesto y ejecución de políticas integrales para la prevención, atención, sanción y reparación de estos delitos, que son un problema estructural.",https://twitter.com/DianaSalazarM2/status/1323803719587287041,tweet,Diana Salazar M.,6,3,27,134,-,0,2020-11-03 20:46:16,
1323803717922131968,"En noches como esta, desde la FGE nos preguntamos si sensibilizar a los agentes fiscales y acompañar a las víctimas y a sus familias es suficiente, y la respuesta es no. Para cambiar esta realidad debemos trabajar en prevención.",https://twitter.com/DianaSalazarM2/status/1323803717922131968,tweet,Diana Salazar M.,24,6,49,160,-,1,2020-11-03 20:46:16,
1321975359676534785,"El trabajo del Sistema de Justicia no puede verse manchado por malas acciones de unos pocos funcionarios. La lucha contra la corrupción empieza en casa. Gracias a quienes denuncian a los malos elementos, porque nos ayudan hacer nuestro trabajo. #FiscalíaContraElDelito",https://twitter.com/DianaSalazarM2/status/1321975359676534785,tweet,Diana Salazar M.,22,7,36,157,-,1,2020-10-29 19:41:01,
1315434499690377216,"Aprovecho el #DíaDeLaNiña para recordar que queremos niñas con las mismas oportunidades, esto es crucial para alcanzar la igualdad en las próximas generaciones. Trabajemos para que todas, desde las aulas, hagan realidad sus sueños. https://t.co/t9tQgW6OZz",https://twitter.com/DianaSalazarM2/status/1315434499690377216,tweet,Diana Salazar M.,38,4,67,416,-,0,2020-10-11 18:29:58,https://pbs.twimg.com/media/EkFctFwX0AA-npL.jpg
1310703757550923776,Cualquier tipo de violencia debe ser denunciada. Desde la FGE trabajamos todos los días para que la violencia contra la mujer no quede en la impunidad. Esta sentencia demuestra que nadie está sobre la ley. #FiscalíaConLasVíctimas,https://twitter.com/DianaSalazarM2/status/1310703757550923776,tweet,Diana Salazar M.,22,3,43,157,-,0,2020-09-28 17:11:42,
1303731698081902597,@La_chica_velcro Viva la cumpleañera!!! 🎊🎊,https://twitter.com/DianaSalazarM2/status/1303731698081902597,tweet,Diana Salazar M.,9,0,3,23,-,0,2020-09-09 11:27:13,
1300603059047890950,La búsqueda de la verdad es nuestro principal objetivo. Las puertas de #FiscalíaEc están abiertas para quienes cuenten con información que facilite el desarrollo de cualquier investigación. Las denuncias de corrupción no pueden quedar como comentarios sueltos para redes sociales.,https://twitter.com/DianaSalazarM2/status/1300603059047890950,tweet,Diana Salazar M.,328,16,157,663,-,2,2020-08-31 20:15:07,
1300145469331562499,"Hoy, en el marco del #DíaInternacionalDeVíctimasDeDesaparicionesForzadas, envío mi abrazo solidario a la @AsfadecEc y a los familiares de todas 
las personas desaparecidas. Además, reitero nuestro compromiso  para seguir investigando cada uno de estos casos. https://t.co/l2z7x41YmB",https://twitter.com/DianaSalazarM2/status/1300145469331562499,tweet,Diana Salazar M.,82,13,56,277,-,0,2020-08-30 13:56:50,https://pbs.twimg.com/media/EgsLaWFXgAcfnw0.jpg
1297220699447336960,"Cada vez que una mujer es víctima de violencia o femicidio en el Ecuador, nos agreden a todas. Desde la FGE no descansaremos para que se haga justicia en todos los casos, es nuestro compromiso con las víctimas y sus familias. #FiscalíaConLasVíctimas #JusticiaParaGaby",https://twitter.com/DianaSalazarM2/status/1297220699447336960,tweet,Diana Salazar M.,407,32,352,1441,-,1,2020-08-22 12:14:50,
1288693891982663681,"Los intereses que se mueven con mucho dinero, con el afán de empañar la gestión de la Fiscalía,  no impedirán el acceso a la justicia a las víctimas. #FiscaliaConLasVictimas #NoALaImpunidad",https://twitter.com/DianaSalazarM2/status/1288693891982663681,tweet,Diana Salazar M.,327,35,272,868,-,0,2020-07-29 23:32:21,
1287388674607415297,Rompiendo el hielo: Hablemos de Renta Básica Universal para el Ecuador - EcuadorToday %  https://t.co/NPyPPhKEbA,https://twitter.com/DianaSalazarM2/status/1287388674607415297,tweet,Diana Salazar M.,40,3,14,72,-,3,2020-07-26 09:05:53,
1285305137234358273,Desde @FiscaliaEcuador desvirtuamos cada una de las apelaciones de las defensas con argumentos técnico-jurídicos. El Tribunal ha ratificado su sentencia en contra de los 18 y la ha modificado parcialmente con 2 de los sentenciados. #CasoSobornos. Que este sea un precedente.,https://twitter.com/DianaSalazarM2/status/1285305137234358273,tweet,Diana Salazar M.,1043,174,992,3696,-,3,2020-07-20 15:06:39,
1278337052950646784,"Hoy más que nunca urge que Ecuador cuente con una Ley de Extinción de Dominio, para recuperar bienes -casas de lujo, autos de alta gama- conseguidos ilegalmente por quienes ahora están prófugos o por quienes se han aprovechado de beneficios legales para personas que los necesitan",https://twitter.com/DianaSalazarM2/status/1278337052950646784,tweet,Diana Salazar M.,2376,669,5588,13952,-,15,2020-07-01 09:37:58,
1270705882301693955,El resultado de una cooperación ágil y eficaz. Ahora a responder ante la justicia ecuatoriana. #NoMasImpunidad,https://twitter.com/DianaSalazarM2/status/1270705882301693955,tweet,Diana Salazar M.,269,23,250,1191,-,0,2020-06-10 08:14:25,
1268597797374308352,"El sistema de justicia es un engranaje: si una de sus partes falla, el resultado será la impunidad. Desde #FiscalíaEc estamos cumpliendo con nuestra obligación; ojalá todos los demás lo hagan.",https://twitter.com/DianaSalazarM2/status/1268597797374308352,tweet,Diana Salazar M.,1393,283,2009,4809,-,7,2020-06-04 12:37:38,
1268141988597174272,"#FuerzaDeTarea de #FiscaliaEc empieza a dar resultados, no nos detendremos. #NoMasImpunidad",https://twitter.com/DianaSalazarM2/status/1268141988597174272,tweet,Diana Salazar M.,1544,267,1398,5166,-,7,2020-06-03 06:26:25,
1265799479367794690,"Lamentable que la labor de #FiscaliaEc de hacer respetar la Ley,  genere en redes sociales una inusual andanada de comentarios, en su mayoría anónimos, repletos de violencia, y una invitación del CPCCS a ""rendir cuentas""¿Qué pretenden? No pararemos.#NoMasImpunidad https://t.co/O36EVmWqlq",https://twitter.com/DianaSalazarM2/status/1265799479367794690,tweet,Diana Salazar M.,1353,143,710,2270,-,5,2020-05-27 19:18:07,"https://pbs.twimg.com/media/EZEF6HSWoAACmpL.jpg,https://pbs.twimg.com/media/EZEF6HRXgAMPEDD.jpg"
1257297330635567105,"Aprovecharse de la emergencia para robar fondos públicos es de miserables. #FiscalíaEc está desplegando todos sus recursos para investigar a quienes, en medio de la tragedia, estarían haciendo ""negocios."" Desde #Guayaquil dirijo las acciones con el máximo rigor. ¡Ya basta!",https://twitter.com/DianaSalazarM2/status/1257297330635567105,tweet,Diana Salazar M.,2494,412,2133,6001,-,11,2020-05-04 08:13:37,
1252242688310738944,https://t.co/s6XxpQIvdM,https://twitter.com/DianaSalazarM2/status/1252242688310738944,tweet,Diana Salazar M.,157,9,52,133,-,0,2020-04-20 09:28:17,https://pbs.twimg.com/media/EWDcE7SXkAcvBey.jpg
1244015735053090817,@MorlaCasis @cesarlitardo Entiendo la sensibilidad que embarga a todos los ecuatorianos propio del momento que vivimos. Nos unimos en oración por todos los ángeles que hoy tienen nueva morada.,https://twitter.com/DianaSalazarM2/status/1244015735053090817,tweet,Diana Salazar M.,2,0,2,18,-,1,2020-03-28 16:37:18,
1244015336166432768,"@nellas08 @cesarlitardo De acuerdo con Usted Marianella, las oraciones van por todas las almas que ahora se encuentran en el cielo. No es momento de discusión, de unión y sobre todo acción.",https://twitter.com/DianaSalazarM2/status/1244015336166432768,tweet,Diana Salazar M.,1,0,0,3,-,0,2020-03-28 16:35:43,
1244000294993870848,El cielo continúa llamando a sus ángeles. @cesarlitardo nos unimos en oración por el alma de tú madre. Un abrazo fraterno.,https://twitter.com/DianaSalazarM2/status/1244000294993870848,tweet,Diana Salazar M.,19,2,24,135,-,0,2020-03-28 15:35:57,
1243556629171376140,@Expresoec @raguilarandrade Más claro imposible. 👏🏾👏🏾👏🏾.,https://twitter.com/DianaSalazarM2/status/1243556629171376140,tweet,Diana Salazar M.,23,4,4,61,-,0,2020-03-27 10:12:59,
1242502350754975747,"Es momento de estar unidos, solo así superaremos la adversidad. #QuedateEnCasa mientras la Fiscalía continúa trabajando.",https://twitter.com/DianaSalazarM2/status/1242502350754975747,tweet,Diana Salazar M.,37,4,100,300,-,0,2020-03-24 12:23:39,
1242132479248646150,"Uno de los héroes silenciosos se adelantó hoy al encuentro con el Creador. Esta pandemia no nos detendrá, seguiremos con más fuerza y saldremos adelante. La familia de Fiscalía más unida que nunca. https://t.co/2R5cYtZojm",https://twitter.com/DianaSalazarM2/status/1242132479248646150,tweet,Diana Salazar M.,58,14,302,815,-,1,2020-03-23 11:53:55,https://pbs.twimg.com/media/ETzw52AWkAYu7bF.jpg
1241348545497698305,@WilsonMerinoR @Lenin @LoroHomero @ottosonnenh @mariapaularomo @Salud_Ec @PaolaPabonC @Lilia_Yunda @InclusionEc @EstebanOrtizMD @forosaludec @La_chica_velcro @janethinostroza @jcarlosaizprua 👏🏾👏🏾,https://twitter.com/DianaSalazarM2/status/1241348545497698305,tweet,Diana Salazar M.,9,0,2,34,-,0,2020-03-21 07:58:51,
1240810567507611648,Solo el trabajo solidario y comprometido hará que superemos esta dura prueba. Gracias a todos los compañeros de FGE por su trabajo. https://t.co/jzDiD8wT0l,https://twitter.com/DianaSalazarM2/status/1240810567507611648,tweet,Diana Salazar M.,61,3,80,375,-,0,2020-03-19 20:21:07,https://pbs.twimg.com/media/ETg-mc9XQAAJ14-.jpg
1239285755538800642,"El esfuerzo de cada uno de nosotros es el que hará la diferencia en estos momentos. Con esperanza, responsabilidad, sensatez y solidaridad, saldremos adelante. #YoMeQuedoEnCasa https://t.co/Yms2Fsr5Ai",https://twitter.com/DianaSalazarM2/status/1239285755538800642,tweet,Diana Salazar M.,163,23,302,921,-,0,2020-03-15 15:22:03,https://pbs.twimg.com/media/ETLTxVJXYAEBMJB.jpg
1234103145363656705,https://t.co/sd567kGsKG,https://twitter.com/DianaSalazarM2/status/1234103145363656705,tweet,Diana Salazar M.,1403,269,1813,3641,-,6,2020-03-01 08:08:13,https://pbs.twimg.com/ext_tw_video_thumb/1234103112383827969/pu/img/eY2xfbw0hsEGldYj.jpg
1202622100432916480,"A diferencia de otros casos estructurados con elementos de convicción contundentes,en el de Sofía Espin,abierto en Sep/18,no hubo un enfoque tecnico-jurídico adecuado,por lo cual, persistir en la acusación no sería ético y contraviene principios básicos de Derecho.",https://twitter.com/DianaSalazarM2/status/1202622100432916480,tweet,Diana Salazar M.,439,93,176,685,-,3,2019-12-05 11:13:47,
1198979224750755841,@CondorECUADOR Creo que alguien necesita revisar su ortografía y sobre todo significado. Buen día. Saludos estimado. https://t.co/dmgJC20WbJ,https://twitter.com/DianaSalazarM2/status/1198979224750755841,tweet,Diana Salazar M.,7,0,0,11,-,0,2019-11-25 09:58:17,https://pbs.twimg.com/media/EKOhPvjWsAAD6OC.jpg
1198964112413351936,"Todos somos hijos de una mujer. La violencia nunca es la solución y siempre es el problema. De la forma que sea no es tolerable ni excusable.  La violencia siega sueños, ilusiones, esperanzas y vidas. Su erradicación es tarea de todos. #diacontralaviolenciadegenero",https://twitter.com/DianaSalazarM2/status/1198964112413351936,tweet,Diana Salazar M.,46,8,157,708,-,0,2019-11-25 08:58:14,
1197534836174528512,Quienes impartimos justicia estamos sujetos a un estándar mayor que el resto de la ciudadanía. La FGE no tendrá la menor tolerancia con malos funcionarios de la Fiscalía y policía que abusen de su posición para delinquir.#CeroToleranciaALaCorrupción #NoMasImpunidad,https://twitter.com/DianaSalazarM2/status/1197534836174528512,tweet,Diana Salazar M.,1292,197,890,3369,-,4,2019-11-21 10:18:48,
1183146157574369281,"La Fiscalía garantiza que, en el ámbito de sus competencias, identificará a los responsables de estos delitos y velará porque respondan ante la justicia con el máximo rigor de la ley.",https://twitter.com/DianaSalazarM2/status/1183146157574369281,tweet,Diana Salazar M.,516,90,1349,3661,-,1,2019-10-12 17:23:20,
1183146155707916288,"En estos momentos, en los que el caos parecería prevalecer, la FGE reafirma su compromiso con la paz y la justicia en el Ecuador. Aquellos que no aman al país, que sueñan con verlo destruido, que no se miden en ejecutar planes macabros para conseguir la impunidad, NO LO LOGRARÁN.",https://twitter.com/DianaSalazarM2/status/1183146155707916288,tweet,Diana Salazar M.,1261,196,3335,8343,-,5,2019-10-12 17:23:19,
1181637862032318465,"La protesta social pacífica es legítima, NO A LOS INFILTRADOS #EcuadorPaisDePaz",https://twitter.com/DianaSalazarM2/status/1181637862032318465,tweet,Diana Salazar M.,107,21,366,793,-,2,2019-10-08 13:29:54,
1180296780619161601,"Creo en el derecho a la resistencia, pero también a la libre circulación y expresión así como en el respeto a la propiedad pública y privada. Bajo mi administración, la ley será aplicada para preservar estos conceptos fundamentales. #FiscaliaEc #NoMasImpunidad",https://twitter.com/DianaSalazarM2/status/1180296780619161601,tweet,Diana Salazar M.,633,105,1012,3221,-,3,2019-10-04 20:40:56,
1171893519864279042,"Como madre, hija y ecuatoriana, quiero dejar claro mi compromiso personal con los más vulnerables. Durante mi gestión, no se dejará sola a ninguna víctima de abuso o violencia en todas sus formas. Haré lo posible para que cese la sensación de impotencia frente a la impunidad. https://t.co/vAxCDZlmOq",https://twitter.com/DianaSalazarM2/status/1171893519864279042,tweet,Diana Salazar M.,469,104,734,2287,-,2,2019-09-11 16:09:22,https://pbs.twimg.com/media/EENm7G2X4AE28B6.jpg
1150133148379836416,#ReyArupo2019 @Rafael_Lugo_N Av. Eloy Alfaro y Guanguiltagua-Plaza República de Chile. Mi contribución de este año https://t.co/zHdixHeFIz,https://twitter.com/DianaSalazarM2/status/1150133148379836416,tweet,Diana Salazar M.,33,0,20,195,-,0,2019-07-13 15:01:25,"https://pbs.twimg.com/media/D_YX_rzXkAEZF_Y.jpg,https://pbs.twimg.com/media/D_YX_r0XsAAbdEg.jpg"
1147704341333233664,https://t.co/bKE4Ln5e9I,https://twitter.com/DianaSalazarM2/status/1147704341333233664,tweet,Diana Salazar M.,767,123,681,1706,-,14,2019-07-06 22:10:12,https://pbs.twimg.com/ext_tw_video_thumb/1146653249883254784/pu/img/AGtcyMW3VXcCCqb4.jpg
1146642939466211328,Esta experiencia tan solo nos motiva en la FGE a reforzar nuestro compromiso de luchar contra la impunidad y devolver la esperanza en la justicia a la gente buena de este país.,https://twitter.com/DianaSalazarM2/status/1146642939466211328,tweet,Diana Salazar M.,266,46,455,1718,-,2,2019-07-03 23:52:35,
1146642936429498368,Hoy sentí el despecho de querer hacer lo correcto por mí país y encontrarme luchando contra un mecanismo patriarcal y caduco que desprecia a la justicia y atropella a quienes no  comprometemos nuestros principios.,https://twitter.com/DianaSalazarM2/status/1146642936429498368,tweet,Diana Salazar M.,1825,283,1986,5460,-,7,2019-07-03 23:52:34,
1135222345520570368,"Por el contrario, el apoyo manifestado mayoritariamente por la gente cansada de una justicia a la que sentía lejana o ausente nos motiva a seguir adelante en una lucha sin compromisos contra la corrupción.",https://twitter.com/DianaSalazarM2/status/1135222345520570368,tweet,Diana Salazar M.,409,55,586,2418,-,1,2019-06-02 11:31:13,
1135222344065200135,"Es pertinente aclarar que con las acciones emprendidas por FGE en los últimos días, aparte de los improperios y groserías por parte de uno de los implicados en la audiencia no he recibido amenazas.",https://twitter.com/DianaSalazarM2/status/1135222344065200135,tweet,Diana Salazar M.,641,80,805,2882,-,6,2019-06-02 11:31:12,
1133357932635152385,"“El amor cura y el odio mata”, el sorprendente consejo de un genio de la medicina https://t.co/zBigPmw0hd",https://twitter.com/DianaSalazarM2/status/1133357932635152385,tweet,Diana Salazar M.,76,10,241,580,-,7,2019-05-28 08:02:42,
1130227014986809345,"Recordar al país que la dignidad, la integridad y el patriotismo son más importantes e imperecederos que el poder y el dinero es el legado del Dr. Julio César Trujillo. Prometo seguir sus pasos por ese sendero de valores y justicia. Hasta pronto Doctor Julito! #JulioCésarTrujillo",https://twitter.com/DianaSalazarM2/status/1130227014986809345,tweet,Diana Salazar M.,495,90,1235,4382,-,6,2019-05-19 16:41:33,
1130219027048128515,https://t.co/oNtxr3gM9K,https://twitter.com/DianaSalazarM2/status/1130219027048128515,tweet,Diana Salazar M.,44,10,278,910,-,1,2019-05-19 16:09:49,https://pbs.twimg.com/media/D69YNRXX4AAsuhk.jpg
1126340332038295552,"No toleraremos indolencia e inacción por parte de los funcionarios de FGE en casos que representan abuso contra niñas, niños, adolescentes. He dispuesto poner especial atención a estos temas que tanto afectan a nuestra sociedad.",https://twitter.com/DianaSalazarM2/status/1126340332038295552,tweet,Diana Salazar M.,377,94,1105,3252,-,7,2019-05-08 23:17:16,
1118939520802742272,Solicitaré a los organismos encargados de control que revisen las actuaciones de la jueza Beatriz Benítez y verifiquen su patrimonio. #JuntosContraLaCorrupción 4/4,https://twitter.com/DianaSalazarM2/status/1118939520802742272,tweet,Diana Salazar M.,794,105,976,2619,-,1,2019-04-18 13:09:05,
1118939346374201349,Realizaré todas las acciones que en derecho me asistan para no permitir más impunidad ni dejar que los casos se pierdan en el tiempo por la irresponsabilidad de unos pocos funcionarios que no quieren que el país cambie. #JuntosContraLaCorrupción 3/4,https://twitter.com/DianaSalazarM2/status/1118939346374201349,tweet,Diana Salazar M.,268,44,523,1305,-,0,2019-04-18 13:08:23,
1118939344868392965,Es mejor prevenir que lamentar y el deber de todos los operadores de justicia es velar para que no exista más impunidad en el país. Pido a la ciudadanía estar alerta y su apoyo en la lucha contra la corrupción. #JuntosContraLaCorrupción 2/4,https://twitter.com/DianaSalazarM2/status/1118939344868392965,tweet,Diana Salazar M.,550,96,449,1084,-,2,2019-04-18 13:08:23,
1118939342376964099,"El sábado Fiscalía solicitó una orden de detención contra Ricardo Patiño cuando aún se encontraba en el país, de manera fundamentada. Una juez la desechó. El país no puede seguir así.  #JuntosContraLaCorrupción 1/4",https://twitter.com/DianaSalazarM2/status/1118939342376964099,tweet,Diana Salazar M.,747,159,1483,2919,-,3,2019-04-18 13:08:22,
1113267857981431809,"Desde la Fiscalía General del Estado no habrá persecución, nuestro compromiso es trabajar sin temor y sin favor a nadie. Perseguiremos delitos, no personas. #PorUnaFiscaliaSinCorrupción",https://twitter.com/DianaSalazarM2/status/1113267857981431809,tweet,Diana Salazar M.,665,96,629,2195,-,0,2019-04-02 21:31:55,
1113267634924027904,"Trabajaremos para que se haga justicia en delitos que involucren violaciones a niños, violencia de género, trata de personas, casos como el de Carolina, tendrán atención prioritaria. #NoMásImpunidad",https://twitter.com/DianaSalazarM2/status/1113267634924027904,tweet,Diana Salazar M.,111,31,295,927,-,0,2019-04-02 21:31:02,
1113263006484520962,"Próximamente habilitaremos canales de denuncias para recibir casos que involucren a funcionarios en actos de corrupción en la Fiscalía General del Estado. 
#PorUnaFiscaliaSinCorrupción",https://twitter.com/DianaSalazarM2/status/1113263006484520962,tweet,Diana Salazar M.,205,39,457,1269,-,0,2019-04-02 21:12:38,
1113262794944798721,Revisaremos la información disponible en los expedientes de la Fiscalía y seguiremos el rastro de la corrupción en todos los lugares y países a los que nos lleve la investigación. #CasoOdebrecht #NoMásImpunidad,https://twitter.com/DianaSalazarM2/status/1113262794944798721,tweet,Diana Salazar M.,95,22,155,426,-,1,2019-04-02 21:11:48,
1113261507461169152,La muerte del militar Wilson Ilaquiche también estará entre las prioridades de la Fiscalía. Daremos respuestas oportunas a su familia. #NoMásImpunidad,https://twitter.com/DianaSalazarM2/status/1113261507461169152,tweet,Diana Salazar M.,20,5,147,431,-,0,2019-04-02 21:06:41,
1113260775408394241,"El secuestro y asesinato de Óscar Villacís y Katty Velasco tampoco será olvidado, llegaremos a la verdad. #NoMásImpunidad",https://twitter.com/DianaSalazarM2/status/1113260775408394241,tweet,Diana Salazar M.,14,2,106,351,-,0,2019-04-02 21:03:46,
1113258484345319424,"#NoMásImpunidad. Investigaremos el atentado en el que murieron los miembros de la Armada Luis Mosquera, Jairon Sandoval, Sergio Elaje y Wilmer Álvarez.",https://twitter.com/DianaSalazarM2/status/1113258484345319424,tweet,Diana Salazar M.,11,8,119,312,-,0,2019-04-02 20:54:40,
1113258263036850176,"Ha pasado más de un año del secuestro y asesinato de Javier, Paúl y Efrain, desde la Fiscalía General del Estado, trabajaremos para que este hecho no quede en la impunidad.
#NosFaltanTres
#NoMásImpunidad",https://twitter.com/DianaSalazarM2/status/1113258263036850176,tweet,Diana Salazar M.,138,35,339,1037,-,0,2019-04-02 20:53:47,
1113256701765967872,"Una vez concluido el concurso para la selección de Fiscal General, he resuelto habilitar mi cuenta de Twitter para recibir las sugerencias ciudadanas.  #EscuchamosALosCiudadanos 
#TuVozsEscuchaEnLaFiscalia
#FiscaliaCercanaALaGente",https://twitter.com/DianaSalazarM2/status/1113256701765967872,tweet,Diana Salazar M.,575,78,601,2501,-,4,2019-04-02 20:47:35,